{
  "title": "Server-Side GTM Benchmarked: What It Really Improves—and What It Does Not",
  "canonical_url": "https://metricfixer.com/publications/analytics-conversion-tracking/server-side-gtm-real-gains-marketing-myths-benchmark",
  "repository": "https://github.com/metricfixer/server-side-gtm-benchmark",
  "benchmark_release": "v1.0.0",
  "benchmark_run_date": "2026-07-31",
  "repository_package_date": "2026-08-04"
}
